{
  "width": 32,
  "height": 18,
  "tile_size": 1.0,
  "tiles": [
    [
      "wall",
      "grass",
      "grass",
      "grass",
      "grass",
      "grass",
      "grass",
      "grass",
      "grass",
      "grass",
      "grass",
      "grass",
      "grass",
      "grass",
      "grass",
      "river",
      "river",
      "grass",
      "grass",
      "grass",
      "grass",
      "grass",
      "grass",
      "grass",
      "grass",
      "grass",
      "grass",
      "grass",
      "grass",
      "grass",
      "grass",
      "wall"
    ],
    [
      "wall",
      "grass",
      "grass",
      "grass",
      "grass",
      "grass",
      "grass",
      "grass",
      "grass",
      "grass",
      "grass",
      "grass",
      "grass",
      "grass",
      "grass",
      "river",
      "river",
      "grass",
      "grass",
      "grass",
      "grass",
      "grass",
      "grass",
      "grass",
      "grass",
      "grass",
      "grass",
      "grass",
      "grass",
      "grass",
      "grass",
      "wall"
    ],
    [
      "wall",
      "grass",
      "grass",
      "grass",
      "grass",
      "tower",
      "tower",
      "tower",
      "grass",
      "grass",
      "grass",
      "grass",
      "grass",
      "grass",
      "grass",
      "river",
      "river",
      "grass",
      "grass",
      "grass",
      "grass",
      "grass",
      "grass",
      "grass",
      "tower",
      "tower",
      "tower",
      "grass",
      "grass",
      "grass",
      "grass",
      "wall"
    ],
    [
      "wall",
      "grass",
      "grass",
      "grass",
      "grass",
      "tower",
      "tower",
      "tower",
      "grass",
      "grass",
      "grass",
      "grass",
      "grass",
      "grass",
      "grass",
      "bridge",
      "bridge",
      "grass",
      "grass",
      "grass",
      "grass",
      "grass",
      "grass",
      "grass",
      "tower",
      "tower",
      "tower",
      "grass",
      "grass",
      "grass",
      "grass",
      "wall"
    ],
    [
      "wall",
      "grass",
      "grass",
      "grass",
      "grass",
      "tower",
      "tower",
      "tower",
      "grass",
      "grass",
      "grass",
      "grass",
      "grass",
      "grass",
      "grass",
      "river",
      "river",
      "grass",
      "grass",
      "grass",
      "grass",
      "grass",
      "grass",
      "grass",
      "tower",
      "tower",
      "tower",
      "grass",
      "grass",
      "grass",
      "grass",
      "wall"
    ],
    [
      "wall",
      "grass",
      "grass",
      "grass",
      "grass",
      "grass",
      "grass",
      "grass",
      "grass",
      "grass",
      "grass",
      "grass",
      "grass",
      "grass",
      "grass",
      "river",
      "river",
      "grass",
      "grass",
      "grass",
      "grass",
      "grass",
      "grass",
      "grass",
      "grass",
      "grass",
      "grass",
      "grass",
      "grass",
      "grass",
      "grass",
      "wall"
    ],
    [
      "grass",
      "grass",
      "grass",
      "grass",
      "grass",
      "grass",
      "grass",
      "grass",
      "grass",
      "grass",
      "grass",
      "grass",
      "grass",
      "grass",
      "grass",
      "river",
      "river",
      "grass",
      "grass",
      "grass",
      "grass",
      "grass",
      "grass",
      "grass",
      "grass",
      "grass",
      "grass",
      "grass",
      "grass",
      "grass",
      "grass",
      "grass"
    ],
    [
      "grass",
      "tower",
      "tower",
      "tower",
      "tower",
      "grass",
      "grass",
      "grass",
      "grass",
      "grass",
      "grass",
      "grass",
      "grass",
      "grass",
      "grass",
      "river",
      "river",
      "grass",
      "grass",
      "grass",
      "grass",
      "grass",
      "grass",
      "grass",
      "grass",
      "grass",
      "grass",
      "tower",
      "tower",
      "tower",
      "tower",
      "grass"
    ],
    [
      "grass",
      "tower",
      "tower",
      "tower",
      "tower",
      "grass",
      "grass",
      "grass",
      "grass",
      "grass",
      "grass",
      "grass",
      "grass",
      "grass",
      "grass",
      "river",
      "river",
      "grass",
      "grass",
      "grass",
      "grass",
      "grass",
      "grass",
      "grass",
      "grass",
      "grass",
      "grass",
      "tower",
      "tower",
      "tower",
      "tower",
      "grass"
    ],
    [
      "grass",
      "tower",
      "tower",
      "tower",
      "tower",
      "grass",
      "grass",
      "grass",
      "grass",
      "grass",
      "grass",
      "grass",
      "grass",
      "grass",
      "grass",
      "river",
      "river",
      "grass",
      "grass",
      "grass",
      "grass",
      "grass",
      "grass",
      "grass",
      "grass",
      "grass",
      "grass",
      "tower",
      "tower",
      "tower",
      "tower",
      "grass"
    ],
    [
      "grass",
      "tower",
      "tower",
      "tower",
      "tower",
      "grass",
      "grass",
      "grass",
      "grass",
      "grass",
      "grass",
      "grass",
      "grass",
      "grass",
      "grass",
      "river",
      "river",
      "grass",
      "grass",
      "grass",
      "grass",
      "grass",
      "grass",
      "grass",
      "grass",
      "grass",
      "grass",
      "tower",
      "tower",
      "tower",
      "tower",
      "grass"
    ],
    [
      "grass",
      "grass",
      "grass",
      "grass",
      "grass",
      "grass",
      "grass",
      "grass",
      "grass",
      "grass",
      "grass",
      "grass",
      "grass",
      "grass",
      "grass",
      "river",
      "river",
      "grass",
      "grass",
      "grass",
      "grass",
      "grass",
      "grass",
      "grass",
      "grass",
      "grass",
      "grass",
      "grass",
      "grass",
      "grass",
      "grass",
      "grass"
    ],
    [
      "wall",
      "grass",
      "grass",
      "grass",
      "grass",
      "grass",
      "grass",
      "grass",
      "grass",
      "grass",
      "grass",
      "grass",
      "grass",
      "grass",
      "grass",
      "river",
      "river",
      "grass",
      "grass",
      "grass",
      "grass",
      "grass",
      "grass",
      "grass",
      "grass",
      "grass",
      "grass",
      "grass",
      "grass",
      "grass",
      "grass",
      "wall"
    ],
    [
      "wall",
      "grass",
      "grass",
      "grass",
      "grass",
      "tower",
      "tower",
      "tower",
      "grass",
      "grass",
      "grass",
      "grass",
      "grass",
      "grass",
      "grass",
      "river",
      "river",
      "grass",
      "grass",
      "grass",
      "grass",
      "grass",
      "grass",
      "grass",
      "tower",
      "tower",
      "tower",
      "grass",
      "grass",
      "grass",
      "grass",
      "wall"
    ],
    [
      "wall",
      "grass",
      "grass",
      "grass",
      "grass",
      "tower",
      "tower",
      "tower",
      "grass",
      "grass",
      "grass",
      "grass",
      "grass",
      "grass",
      "grass",
      "bridge",
      "bridge",
      "grass",
      "grass",
      "grass",
      "grass",
      "grass",
      "grass",
      "grass",
      "tower",
      "tower",
      "tower",
      "grass",
      "grass",
      "grass",
      "grass",
      "wall"
    ],
    [
      "wall",
      "grass",
      "grass",
      "grass",
      "grass",
      "tower",
      "tower",
      "tower",
      "grass",
      "grass",
      "grass",
      "grass",
      "grass",
      "grass",
      "grass",
      "river",
      "river",
      "grass",
      "grass",
      "grass",
      "grass",
      "grass",
      "grass",
      "grass",
      "tower",
      "tower",
      "tower",
      "grass",
      "grass",
      "grass",
      "grass",
      "wall"
    ],
    [
      "wall",
      "grass",
      "grass",
      "grass",
      "grass",
      "grass",
      "grass",
      "grass",
      "grass",
      "grass",
      "grass",
      "grass",
      "grass",
      "grass",
      "grass",
      "river",
      "river",
      "grass",
      "grass",
      "grass",
      "grass",
      "grass",
      "grass",
      "grass",
      "grass",
      "grass",
      "grass",
      "grass",
      "grass",
      "grass",
      "grass",
      "wall"
    ],
    [
      "wall",
      "grass",
      "grass",
      "grass",
      "grass",
      "grass",
      "grass",
      "grass",
      "grass",
      "grass",
      "grass",
      "grass",
      "grass",
      "grass",
      "grass",
      "river",
      "river",
      "grass",
      "grass",
      "grass",
      "grass",
      "grass",
      "grass",
      "grass",
      "grass",
      "grass",
      "grass",
      "grass",
      "grass",
      "grass",
      "grass",
      "wall"
    ]
  ],
  "towers": {
    "player1": {
      "king": {
        "x": 15.5,
        "y": 2.5,
        "tile_x": 15,
        "tile_y": 2
      },
      "left_princess": {
        "x": 8.5,
        "y": 5.5,
        "tile_x": 8,
        "tile_y": 5
      },
      "right_princess": {
        "x": 22.5,
        "y": 5.5,
        "tile_x": 22,
        "tile_y": 5
      }
    },
    "player2": {
      "king": {
        "x": 15.5,
        "y": 15.5,
        "tile_x": 15,
        "tile_y": 15
      },
      "left_princess": {
        "x": 22.5,
        "y": 12.5,
        "tile_x": 22,
        "tile_y": 12
      },
      "right_princess": {
        "x": 8.5,
        "y": 12.5,
        "tile_x": 8,
        "tile_y": 12
      }
    }
  },
  "spawn_zones": {
    "player1": {
      "min_x": 0.0,
      "min_y": 0.0,
      "max_x": 32.0,
      "max_y": 9.0
    },
    "player2": {
      "min_x": 0.0,
      "min_y": 9.0,
      "max_x": 32.0,
      "max_y": 18.0
    }
  }
}